{
  "admission_status": "blocked",
  "admitted": false,
  "approval_artifact_present": false,
  "approval_required": true,
  "approval_status": "not_approved",
  "blocked_execution_surfaces": [
    "frontend_package_import",
    "plugin_discovery",
    "triton_jit_execution",
    "device_access",
    "generated_artifact_execution",
    "native_backend_execution",
    "python_import",
    "network_access",
    "subprocess_execution",
    "dynamic_library_loading"
  ],
  "decision": "deny_until_external_approval",
  "direct_source_ingestion": false,
  "evidence_policy": "digest_only_source_free",
  "gate_contract": "source_ingestion_admission_gate.fail_closed.v0",
  "gate_id": "source_ingestion_admission_gate",
  "gate_report_digest": "sha256:615b473dc58cfd5eaae7e5a200727f0e693d1e60def0bc3e12d29896b85f4261",
  "gate_status": "blocked_missing_maintainer_security_review_approval",
  "issues": [],
  "maintainer_review_packet": {
    "contract": "source_ingestion_maintainer_security_review_packet.review.v0",
    "digest": "sha256:53c82efca65861b365a44e54cc0408da379ff0640a899bcb4ccff768d679a574",
    "evidence_id": "source_ingestion_maintainer_security_review_packet",
    "source_free": true,
    "status": "ready_for_maintainer_review",
    "supports_gate": true
  },
  "required_control_count": 13,
  "required_controls": [
    "maintainer_review_packet_bound",
    "approval_criteria_bound_by_review_packet",
    "external_approval_artifact_required",
    "external_approval_artifact_absent",
    "direct_source_ingestion_false",
    "source_to_compute_graph_false",
    "source_to_hac_ir_false",
    "source_to_runtime_plan_false",
    "no_source_text_serialization",
    "no_source_intent_payload_serialization",
    "no_runtime_handle_serialization",
    "no_generated_artifacts",
    "fail_closed_until_approval"
  ],
  "required_external_evidence": [
    "maintainer_security_review_approval"
  ],
  "required_external_evidence_count": 1,
  "schema_version": "tuc.source_ingestion_admission_gate_report.v0",
  "source_ingestion_admission_ready": false,
  "source_to_compute_graph": false,
  "source_to_hac_ir": false,
  "source_to_runtime_plan": false,
  "target_slice": "bounded_source_buffer_to_source_intent_plain_data",
  "target_surface": "direct_source_ingestion"
}
